<?xml version="1.0"?>
<!DOCTYPE PPLTServer SYSTEM "PPLT-Server-0.1.dtd">
<PPLTServer name="JVisuServer" class="Visu" version="0.3.0">
	<Head>
		<Description lang="de">Mit diesem Server können sie den Symbolbaum
		für die JVisu Visualisierung exportieren.</Description>
		<Description lang="en">With this Server you can export the Symboltree
		for the JVisu visualisation.</Description>

		<Require>
			<DCPUModule>Export.JVisu</DCPUModule>
			<Variable name="Address" default="127.0.0.1">
				<Description lang="de">Geben sie hier die Adresse der 
				Schnitstelle an, auf dem der Server auf neue Verbindungen 
				warten soll.</Description>
				<Description lang="en">Put here the address to bind to.
				</Description>
			</Variable>
			<Variable name="Port" default="2200">
				<Description lang="de">Geben sie hier den Port an, auf dem der
				Server auf neue Verbindungen warten soll.</Description>
				<Description lang="en">Put here the port to bind to.
				</Description>
			</Variable>
		</Require>
	</Head>
	
	<Setup>
		<Load name="Export.JVisu">
			<Parameter name="Address"><Variable name="Address"/></Parameter>
			<Parameter name="Port"><Variable name="Port"/></Parameter>
		</Load>
	</Setup>
</PPLTServer>
